batter,runs,balls,fours,sixes,strike_rate,dismissal
Dhanusri Muhunan,15,21,2,0,71.43,c Cai Yuzhi b Zhao Yihan
Nur Qaireen Syakira Abedul Samad,10,28,0,0,35.71,c Zhao Yihan b Wang Huiying
Mas Elysa Yasmin,9,11,0,0,81.82,run out (Mingyue Zhu)
Mahirah Izzati Ismail,5,5,0,0,100.0,c Xie Wenyan b Cai Yuzhi
Nur Dania Syuhada,5,9,0,0,55.56,b Cai Yuzhi
Winifred Duraisingam,15,22,0,0,68.18,b Ma Ruike
Nur Arianna Natsya,0,1,0,0,0.0,c Jiaping Li b Cai Yuzhi
Nur Qalysha Noreffendi,14,20,0,0,70.0,run out (Mingyue Zhu)
Nurin Imanina,2,3,0,0,66.67,not out
